{
  "$schema": "https://json-schema.org/draft/2020-12/schema",
  "$id": "https://raw.githubusercontent.com/agent-kit-startup/agent-kit/main/schemas/agent-kit.manifest.schema.json",
  "title": "Agent Kit project manifest",
  "description": "Distribution manifest for an installed Agent Kit workspace (.cursor/agent-kit.json). Tracks kit version, L1 packs, L2 skills, and L3 paths that update must never overwrite. Distinct from agent-kit.config.json (CLI scan/wizard profile).",
  "type": "object",
  "additionalProperties": false,
  "required": ["schemaVersion", "version"],
  "properties": {
    "$schema": {
      "type": "string",
      "description": "Optional JSON Schema URI for editor validation."
    },
    "schemaVersion": {
      "type": "integer",
      "const": 1,
      "description": "Manifest format version. Bump only on breaking field changes."
    },
    "version": {
      "type": "string",
      "pattern": "^(0|[1-9]\\d*)\\.(0|[1-9]\\d*)\\.(0|[1-9]\\d*)(?:-[0-9A-Za-z.-]+)?(?:\\+[0-9A-Za-z.-]+)?$",
      "description": "Installed Agent Kit product version (semver)."
    },
    "profile": {
      "type": "string",
      "minLength": 1,
      "description": "Install profile id used at bootstrap (e.g. default, lean)."
    },
    "packs": {
      "type": "array",
      "uniqueItems": true,
      "items": {
        "type": "string",
        "minLength": 1,
        "pattern": "^[a-z][a-z0-9-]*$"
      },
      "description": "L1 domain pack ids installed (opt-in). See docs/layers-spec.md."
    },
    "skills": {
      "type": "array",
      "uniqueItems": true,
      "items": {
        "type": "string",
        "minLength": 1,
        "pattern": "^[a-z][a-z0-9-]*$"
      },
      "description": "L2 stack skill ids installed from the registry."
    },
    "protected": {
      "type": "array",
      "uniqueItems": true,
      "items": {
        "type": "string",
        "minLength": 1
      },
      "description": "Globs relative to project root that agent-kit update must never overwrite (L3 + session state)."
    },
    "overrides": {
      "type": "array",
      "items": {
        "type": "object",
        "additionalProperties": false,
        "required": ["path"],
        "properties": {
          "path": {
            "type": "string",
            "minLength": 1,
            "description": "Project-relative path of the L3 override artifact."
          },
          "replaces": {
            "type": "string",
            "minLength": 1,
            "description": "Optional L0–L2 path this override replaces (same role, distinct basename preferred)."
          },
          "note": {
            "type": "string",
            "description": "Short reason the override exists (product docs voice, no session chatter)."
          }
        }
      },
      "description": "Explicit L3 overrides of kit artifacts. Prefer distinct basenames over silent in-place edits."
    },
    "registry": {
      "type": "object",
      "additionalProperties": false,
      "properties": {
        "url": {
          "type": "string",
          "format": "uri",
          "description": "Registry source URL (GitHub repo or raw catalog)."
        },
        "ref": {
          "type": "string",
          "minLength": 1,
          "description": "Git ref or release tag pinned at install/update (e.g. v3.1.0, main)."
        }
      },
      "description": "Where install/update resolved artifacts from."
    },
    "personalization": {
      "type": "object",
      "additionalProperties": false,
      "required": ["contractVersion", "generatorVersion", "origin", "resultPath"],
      "properties": {
        "contractVersion": {
          "type": "integer",
          "minimum": 1
        },
        "generatorVersion": {
          "type": "string",
          "minLength": 1
        },
        "origin": {
          "const": "repository-profile"
        },
        "resultPath": {
          "type": "string",
          "minLength": 1
        }
      },
      "description": "Origin and contract metadata for project-owned personalized artifacts."
    },
    "installedAt": {
      "type": "string",
      "format": "date-time",
      "description": "ISO-8601 timestamp of last successful install or update that wrote this manifest."
    }
  }
}
