{
  "schemaVersion": 1,
  "version": "6.3.0",
  "protected": [
    ".claude/commands/agent-kit.md",
    ".cursor/HANDOFF.md",
    ".cursor/agents/test-suites.md",
    ".cursor/context/backups/**",
    ".cursor/context/config.json",
    ".cursor/context/current/**",
    ".cursor/memory/**",
    ".cursor/plans/**",
    ".cursor/project-context.md",
    ".cursor/rules/cursor-skills-devops.mdc",
    ".cursor/rules/cursor-skills-testing.mdc",
    ".cursor/skills/community/cursor-skills-node/SKILL.md",
    ".cursor/skills/core/docs-repo/SKILL.md",
    "AGENTS.md",
    "CLAUDE.md",
    "templates/CODEOWNERS",
    "templates/gitlab-ci-content.yml",
    "templates/gitlab-ci-docker.yml",
    "templates/gitlab-ci-firebase.yml"
  ],
  "profile": "default",
  "packs": [
    "devops",
    "quality"
  ],
  "skills": [
    "clean-code",
    "clickup",
    "cursor-skills-node",
    "docs-repo",
    "json-data-config",
    "n8n-workflows",
    "prompts-markdown",
    "sql-postgres",
    "ux-message-flows"
  ],
  "personalization": {
    "contractVersion": 1,
    "generatorVersion": "6.2.0",
    "origin": "repository-profile",
    "resultPath": ".cursor/context/personalization.json"
  },
  "registry": {
    "url": "https://github.com/agent-kit-startup/agent-kit-dev",
    "ref": "staging"
  },
  "installedAt": "2026-08-20T17:28:41.571Z"
}
